name,cover,price,author,publisher,isbn,publish_date,pages,path
西南民族学院图书馆民族资料室藏书目录,https://a.dushu.com/img/n200.png,¥0.00,西南民族学院民族资料室编,西南民族学院民族资料室,,1985-01-01,129页,中国文学论著集目续编.jpg
全国各级政协文史资料篇目索引：1960-1990,https://a.dushu.com/img/n200.png,¥400.00,李永璞主编,中国文史出版社,9787503405686,1992-01-01,1104页,中国文学论著集目续编.jpg
'94中国研究生光学学术报告会暨光学沙龙论文摘要集,https://a.dushu.com/img/n200.png,¥0.00,中国科学院教育局主编,中国科学院教育局,,1994-01-01,61页,中国文学论著集目续编.jpg
中山大学图书馆古籍善本书目,https://a.dushu.com/img/n200.png,¥0.00,中山大学图书馆编,中山大学图书馆,,1982-01-01,507页,中国文学论著集目续编.jpg
中山大学图书馆馆藏中文报纸目录：建国前,https://a.dushu.com/img/n200.png,¥0.00,中山大学图书馆编,中山大学图书馆,,1985-01-01,203页,中国文学论著集目续编.jpg
民国时期江苏版图书书目,https://a.dushu.com/img/n200.png,¥29.00,倪波主编,江苏人民出版社,9787214016577,1996-01-01,870页,中国文学论著集目续编.jpg
公安院校中外文公安（警察）期刊馆藏联合目录,https://a.dushu.com/img/n200.png,¥34.50,全国公安高校图书馆协作组,辽宁大学出版社,9787561026151,1993-01-01,18页,中国文学论著集目续编.jpg
化工石油化工产品国内外标准速检手册,https://a.dushu.com/img/n200.png,¥45.00,杨承荫等主编,中国标协化工标准化协会,,1994-01-01,1121页,中国文学论著集目续编.jpg
[沈阳黄金学院]论文摘要：1979-1986,https://a.dushu.com/img/n200.png,¥0.00,沈阳黄金学院编,沈阳黄金学院,,1987-01-01,78页,中国文学论著集目续编.jpg
中国电子与信息科技期刊目录年鉴'93,https://a.dushu.com/img/n200.png,¥35.00,本书编委会编,电子工业出版社,9787505325401,1994-01-01,360页,中国文学论著集目续编.jpg
自然辩证法文献目录索引,https://a.dushu.com/img/n200.png,¥18.80,吕宏等主编,天津古籍出版社,9787805044651,1995-01-01,269页,中国文学论著集目续编.jpg
外文遥感专题文献文摘汇编,https://a.dushu.com/img/n200.png,¥17.60,冯筠等编,中科院兰州文献情报中心《遥感技术与应用》编辑部,,1993-01-01,276页,中国文学论著集目续编.jpg
河北历代地方志总目,https://a.dushu.com/img/n200.png,¥5.50,河北大学地方史研究室编,河北人民出版社,9787202003930,1989-01-01,390页,中国文学论著集目续编.jpg
民国时期总书目：1911-1949,https://a.dushu.com/img/n200.png,¥136.00,北京图书馆编,书目文献出版社,9787501310630,1996-01-01,2册，1155页,中国文学论著集目续编.jpg
江西古今书目,https://a.dushu.com/img/n200.png,¥45.00,张德意，李洪编；江西省新闻出版局资料室编,江西人民出版社,9787210016182,1996-01-01,1275页,中国文学论著集目续编.jpg
河北地方志提要,https://a.dushu.com/img/n200.png,¥13.60,来新厦主编,天津大学出版社,,1992-01-01,527页,中国文学论著集目续编.jpg
易学书目,https://a.dushu.com/img/n200.png,¥14.50,山东省图书馆编,齐鲁书社,9787533303969,1993-01-01,48页,中国文学论著集目续编.jpg
中国高等学校学报大全,https://a.dushu.com/img/n200.png,¥40.00,中华人民共和国国家教育委员会条件装备司编,高等教育出版社,9787040051186,1994-01-01,493页,中国文学论著集目续编.jpg
江西历代刻书,https://a.dushu.com/img/n200.png,¥14.50,杜信孚，漆身起编著,江西人民出版社,9787210013556,1994-01-01,366页,中国文学论著集目续编.jpg
中国社会科学学术论文文摘,https://a.dushu.com/img/n200.png,¥9.00,王义盛主编,社会科学文献出版社,9787800503306,1995-01-01,480页,中国文学论著集目续编.jpg
话剧研究资料要目索引,https://a.dushu.com/img/n200.png,¥19.00,施怀仁，张余编,上海交通大学出版社,9787313011695,1993-01-01,261页,中国文学论著集目续编.jpg
河北工学院科研成果、专利与论著摘要汇编：1988-1990,https://a.dushu.com/img/n200.png,¥0.00,河北工学院科研处编辑,河北工学院科研处,,1991-01-01,232页,中国文学论著集目续编.jpg
江西期刊综录,https://img.dushu.com/2006/05/27/0651007816533.jpg_200.jpg,¥8.00,黄日星，张德意编著,江西人民出版社,9787210013495,1994-01-01,131页,江西期刊综录.jpg
中国地方志目录：香港大学冯平山图书馆藏,https://a.dushu.com/img/n200.png,¥0.00,暂缺,香港大学图书馆,,1990-01-01,142页,中国文学论著集目续编.jpg
玉函山房辑佚书,https://a.dushu.com/img/n200.png,¥198.00,（清）马园翰辑,上海古籍出版社,9787532507887,1990-01-01,4册，3773，27页,中国文学论著集目续编.jpg
安徽省地方志办公室方志类藏书目录,https://a.dushu.com/img/n200.png,¥2.10,安微省地方志办公室资料征集处编,,,1992-01-01,139页,中国文学论著集目续编.jpg
天津图书馆馆藏中文字、词典选目：1980-1990,https://a.dushu.com/img/n200.png,¥6.00,刘淑珍等编,天津图书馆,,1992-01-01,177页,中国文学论著集目续编.jpg
馆藏青海文献目录,https://a.dushu.com/img/n200.png,¥2.80,青海省图书馆编,青海人民出版社,9787225001302,1988-06-01,384页,中国文学论著集目续编.jpg
馆藏丛书目录,https://a.dushu.com/img/n200.png,¥0.00,法兰西学院汉学研究所编,法兰西学院汉学研究所,9782857570462,1991-01-01,264页,中国文学论著集目续编.jpg
纺织系统外文期刊联合目录：1985-1992,https://a.dushu.com/img/n200.png,¥40.00,纺织科技情报资料合理布与资源共享的研究课题组编,纺织工业部科学技术情报研究所,,1993-01-01,326页,中国文学论著集目续编.jpg
建筑科技文献索引：86-90,https://a.dushu.com/img/n200.png,¥40.00,建筑部科技情报研究所编,建筑部科技情报研究所,,1992-01-01,200页,中国文学论著集目续编.jpg
水事文萃：1958年-1993年,https://a.dushu.com/img/n200.png,¥0.00,水利部办公厅新闻宣传处《水利文摘》编辑部编,水利部办公厅新闻宣传处《水利文摘》编辑部,,1993-01-01,403页,中国文学论著集目续编.jpg
广东省中山图书馆馆藏广东新编方志目录初集,https://a.dushu.com/img/n200.png,¥0.00,广东省中山图书馆采编部主编,广东省中山图书馆,,1991-01-01,138页,中国文学论著集目续编.jpg
工业机器人文献索引：1980-1989,https://a.dushu.com/img/n200.png,¥15.00,镇江船舶学院图书馆情报部编,镇江市科技情报研究所,,1991-01-01,115页,中国文学论著集目续编.jpg
唐代的长安与洛阳（索引）,https://a.dushu.com/img/n200.png,¥13.45,（日）平冈武夫，（日）今井清著,上海古籍出版社,9787532500444,1991-01-01,179页,中国文学论著集目续编.jpg
唐五代五十二种笔记小说人名索引,https://a.dushu.com/img/n200.png,¥21.60,方积六，吴冬秀编撰,中华书局,9787101007312,1992-01-01,496页,中国文学论著集目续编.jpg
新时期邓小平研究资料索引：一九七九-一九九二,https://a.dushu.com/img/n200.png,¥3.00,中共河南省委党校图书馆编,中共河南省委党校图书馆,,1992-01-01,205页,中国文学论著集目续编.jpg
1985-1989年度福建省外文期刊联合目录,https://a.dushu.com/img/n200.png,¥20.00,福建省文献情报协作委员会,福建省文献情报协作委员会,,1990-01-01,505页,中国文学论著集目续编.jpg
历代山西人的著作书目,https://a.dushu.com/img/n200.png,¥0.00,于霞裳编,山西省图书馆筹备处,,1958-01-01,37页,中国文学论著集目续编.jpg
1950年全国翻译图书目录,https://a.dushu.com/img/n200.png,¥0.00,中央人民政府出版总署编译局编,中央人民政府出版总署编译局,,1951-01-01,128页,中国文学论著集目续编.jpg
天津市外文化学与化工联合图书目录：俄文部份,https://a.dushu.com/img/n200.png,¥0.00,天津市中心图书馆委员会编,天津市中心图书馆委员会,,1958-01-01,408页,中国文学论著集目续编.jpg
中文参考书简目：1949-1954,https://a.dushu.com/img/n200.png,¥0.00,武汉大学图书馆学专修科一九五五级编,武汉大学图书馆学专修科,,1955-01-01,36页,中国文学论著集目续编.jpg
台湾所见红楼梦研究书目,https://a.dushu.com/img/n200.png,¥36.16,那宗训编著,新文丰出版公司,,1982-09-01,210页,中国文学论著集目续编.jpg
北京地方文献联合书目草稿,https://a.dushu.com/img/n200.png,¥0.00,北京图书馆，首都图书馆主编,首都图书馆,,1958-01-01,107页,中国文学论著集目续编.jpg
台湾公藏方志联合目录,https://a.dushu.com/img/n200.png,¥60.35,国立中央图书馆特藏组编,国立中央图馆,,1981-10-01,248页,中国文学论著集目续编.jpg
福建地方文献及闽人著述综录,https://a.dushu.com/img/n200.png,¥4.60,福建师范大学图书馆古籍组编,福建师范大学图书馆古籍组,,1986-01-01,254页,中国文学论著集目续编.jpg
台湾公藏韩国古书藉联合书目,https://a.dushu.com/img/n200.png,¥94.00,林现圭著,文史哲出版社,9789575470296,1991-01-01,370页,中国文学论著集目续编.jpg
台湾公藏普通本线装书目书名索引,https://a.dushu.com/img/n200.png,¥48.60,国立中央图书馆特藏组编辑,国立中央图书馆,,1982-01-01,1213页,中国文学论著集目续编.jpg
台湾光复后妇女研究文献目录,https://a.dushu.com/img/n200.png,¥0.00,姜兰虹，许美智编,国立台湾大学入口研究中心,,1985-07-01,124页,中国文学论著集目续编.jpg
1986化学化工物理数学西书目录,https://a.dushu.com/img/n200.png,¥0.00,北门书城公司主编,北门书城公司,,1986-01-01,112页,中国文学论著集目续编.jpg
福建省1982-1984年度外文期刊联合目录,https://a.dushu.com/img/n200.png,¥0.00,"""全省外文期刊联合目录""编辑组编","""全省外文期刊联合目录""编辑组",,1985-01-01,520页,中国文学论著集目续编.jpg
福州大学科技论文目录汇编：1977-1985,https://a.dushu.com/img/n200.png,¥0.00,福州大学科研处编,福州大学科研处,,1986-01-01,107页,中国文学论著集目续编.jpg
宋词别集索引三种,https://a.dushu.com/img/n200.png,¥1.00,吴道勤等编,湘潭大学学报编辑部,,1987-01-01,322页,中国文学论著集目续编.jpg
自庄严堪善本书目,https://a.dushu.com/img/n200.png,¥1.45,暂缺,天津古藉出版社,,1985-01-01,141页,中国文学论著集目续编.jpg
孙逸仙博士图书馆图书目录（第八辑）,https://a.dushu.com/img/n200.png,¥0.00,中国国民党中央委员会孙逸仙博士图书馆编,孙逸仙博士图书馆,,1989-01-01,54页,中国文学论著集目续编.jpg
馆编书目索引简介,https://a.dushu.com/img/n200.png,¥0.00,鞍钢技术图书馆编,鞍钢情报研究所,,1985-01-01,93页,中国文学论著集目续编.jpg
药物文献索引：1986,https://a.dushu.com/img/n200.png,¥3.90,谢道刚等编,成都市医学情报研究所,,1987-01-01,180页,中国文学论著集目续编.jpg
当代中国出版物中的德语文学和文化,https://a.dushu.com/img/n200.png,¥0.00,凯译（Kaiser，C.）编,歌德学院北京分院,,1996-01-01,54页,中国文学论著集目续编.jpg
新技术革命资料索引,https://a.dushu.com/img/n200.png,¥0.00,天津社会科学院图书馆编,,,1985-01-01,46页,中国文学论著集目续编.jpg
风俗通义通检,https://a.dushu.com/img/n200.png,¥4.40,中法汉学研究所编,上海古籍出版社,,1987-01-01,1册,中国文学论著集目续编.jpg
新中国建国以来轻工业图书总目录,https://a.dushu.com/img/n200.png,¥9.40,杨斌等编,轻工业出版社,,1986-01-01,2册,中国文学论著集目续编.jpg
重庆市医药书刊联合目录：初稿,https://a.dushu.com/img/n200.png,¥0.00,重庆市卫生局重庆市图书馆编,重庆市卫生局重庆市图书馆,,1956-01-01,589页,中国文学论著集目续编.jpg
新民主主义革命时期影印革命期刊索引：抗日战争时期,https://a.dushu.com/img/n200.png,¥3.45,中共中央党校图书馆编,中共中央党校出版社,,1987-01-01,390页,中国文学论著集目续编.jpg
武汉图书馆馆藏业务资料目录：截至57年9月,https://a.dushu.com/img/n200.png,¥0.00,武汉图书馆编,武汉图书馆,,1957-01-01,66页,中国文学论著集目续编.jpg
上海市各医学图书馆所藏期刊联合目录,https://a.dushu.com/img/n200.png,¥0.00,上海市医学图书馆协会编,上海中华医学会牛惠生图书馆,,1952-01-01,99页,中国文学论著集目续编.jpg
共产主义教育学习参考资料索引,https://a.dushu.com/img/n200.png,¥0.00,重庆市图书馆编,重庆市图书馆,,1958-01-01,28页,中国文学论著集目续编.jpg
山东地区俄文期刊联合目录,https://a.dushu.com/img/n200.png,¥0.00,山东省科学工作委员会图书组编,山东省科学工作委员会图书组,,1958-01-01,71页,中国文学论著集目续编.jpg
天放楼书录,https://a.dushu.com/img/n200.png,¥5.64,封思毅编注,台湾商务印书馆,,1981-11-01,307页,中国文学论著集目续编.jpg
万木草堂遗稿万木草堂遗稿外编：样本,https://a.dushu.com/img/n200.png,¥0.00,康有为，蒋贵麟编,成文出版社有限公司,,1976-12-01,48页,中国文学论著集目续编.jpg
台湾地区社会学论文摘要：1963-1986,https://a.dushu.com/img/n200.png,¥180.00,徐正光主编,中央研究院民族学研究所,9789576710513,1992-06-01,598页,中国文学论著集目续编.jpg
传记文学杂志总目录暨执笔人及篇名索引,https://a.dushu.com/img/n200.png,¥4.84,传记文学杂志社编辑,传记文学杂志社,,1984-07-01,360页,中国文学论著集目续编.jpg
台湾地区文献会期刊总索引,https://a.dushu.com/img/n200.png,¥201.60,高贤治，刘燕丽,龙文出版社,,1989-09-01,342页,中国文学论著集目续编.jpg
台湾地区汉学论著选目：民国七十一年度,https://a.dushu.com/img/n200.png,¥9.00,汉学研究资料及服务中心编,汉学研究资料及服务中心,,1986-04-01,121页,中国文学论著集目续编.jpg
台湾地区汉学论著选目汇编本：民国十一年-七十五年,https://a.dushu.com/img/n200.png,¥80.00,汉学研究资料及服务中心编,汉学研究资料及服务中心,,1987-06-01,552页,中国文学论著集目续编.jpg
台湾通史类著作解题与分析,https://a.dushu.com/img/n200.png,¥44.37,翁佳音著,业强出版社,9789576830716,1992-10-01,197页,中国文学论著集目续编.jpg
近代中国史料丛刊正编、续编、三编目录,https://a.dushu.com/img/n200.png,¥0.00,沈云龙主编,文海出版社,,1991-01-01,1册,中国文学论著集目续编.jpg
西南师范大学图书馆馆藏《周易》研究书目,https://a.dushu.com/img/n200.png,¥0.00,西南师范大学图书馆阅览组编,西南师范大学图书馆阅览组,,1986-01-01,47页,中国文学论著集目续编.jpg
华东师范大学中文期刊目录：1886-1949,https://a.dushu.com/img/n200.png,¥4.20,华东师范大学图书馆编,华东师范大学图书馆,,1986-01-01,233页,中国文学论著集目续编.jpg
华东地质学院庆祝建校三十周年学术论文目录汇编,https://a.dushu.com/img/n200.png,¥0.00,华东地质学院学报编辑室编,华东地质学院学报编辑室,,1986-01-01,52页,中国文学论著集目续编.jpg
经济特区、开发区资料索引：1984年1-8月,https://a.dushu.com/img/n200.png,¥0.00,天津社会科学院图书馆编,天津社会科学院图书馆,,1985-01-01,26页,中国文学论著集目续编.jpg
两宋文学论著集目正编,https://a.dushu.com/img/n200.png,¥0.00,刘德汉编辑,五南图书出版公司,9789571111728,1996-01-01,457页,中国文学论著集目续编.jpg
纺织院校图书馆1982-1984外文新书联合目录,https://a.dushu.com/img/n200.png,¥0.00,苏州丝绸工学院图书馆主编,苏州丝绸工学院图书馆,,1985-01-01,85页,中国文学论著集目续编.jpg
经济体制改革报刊索引,https://a.dushu.com/img/n200.png,¥0.00,内蒙古图书馆书目组编,内蒙古图书馆,,1985-01-01,169页,中国文学论著集目续编.jpg
山西省图书馆馆藏：沙棘专题文献题录,https://a.dushu.com/img/n200.png,¥0.00,山西省图书馆编,山西省图书馆,,1986-01-01,140页,中国文学论著集目续编.jpg
俄苏文学译文索引：1949.10-1985.12,https://a.dushu.com/img/n200.png,¥0.00,北京外国语学院外国文学研究所资料室编,北京外国语学院外国文学研究所资料室,,1987-01-01,416页,中国文学论著集目续编.jpg
山东矿业学院科研成果论著目录汇编：1978-1984,https://a.dushu.com/img/n200.png,¥0.00,山东矿业学院科研处编,山东矿业学院科研处,,1985-01-01,51页,中国文学论著集目续编.jpg
东北师范大学图书馆藏古籍分类目录,https://a.dushu.com/img/n200.png,¥75.00,东北师范大学图书馆古籍部编,东北师范大学图书馆古籍部,,1987-01-01,5册,中国文学论著集目续编.jpg
苏联西伯利亚与远东问题俄文期刊文章索引,https://a.dushu.com/img/n200.png,¥0.00,黑龙江省社会科学院西伯利亚研究所资料编译室编,黑龙江省社会科学院西伯利亚研究所,,1985-01-01,198页,中国文学论著集目续编.jpg
[山东省图书馆]革命文献书目,https://a.dushu.com/img/n200.png,¥7.00,山东省图书馆编,山东省图书馆,,1987-01-01,149页,中国文学论著集目续编.jpg
现存宋人别集版本目录,https://a.dushu.com/img/n200.png,¥10.60,四川大学古籍整理研究所编,巴蜀书社,9787805233420,1990-06-01,430页,中国文学论著集目续编.jpg
明遗民传记资料索引,https://a.dushu.com/img/n200.png,¥202.10,谢正光编著,新文丰出版公司,9789571700830,1990-12-01,53页,中国文学论著集目续编.jpg
馆藏大陆期刊联合目录,https://a.dushu.com/img/n200.png,¥0.00,台湾大学图书馆编,,,1991-12-01,1册,中国文学论著集目续编.jpg
上海市吴淞区机械工程学会学术论文及技术经验交流摘要汇编,https://a.dushu.com/img/n200.png,¥0.00,上海市吴淞区机械工程学会编,上海市吴淞区机械工程学会,,1986-01-01,50页,中国文学论著集目续编.jpg
政法社会学论点选编：1978年底-1987年初,https://a.dushu.com/img/n200.png,¥1.10,《新华文摘》编辑部编,中国人民大学出版社,9787300002002,1987-11-01,175页,中国文学论著集目续编.jpg
上海“孤岛”文学报刊编目,https://a.dushu.com/img/n200.png,¥8.00,上海社会科学院文学研究所现代文学研究室，上海图书馆特藏部文献组编,上海社会科学院出版社,,1986-01-01,566页,中国文学论著集目续编.jpg
上海体育科学研究所论文摘要选编,https://a.dushu.com/img/n200.png,¥0.00,上海体育科学研究所编,上海体育科学研究所,,1985-01-01,83页,中国文学论著集目续编.jpg
航空期刊联合目录：1965-1983馆藏,https://a.dushu.com/img/n200.png,¥19.00,航空工业部科学技术情报所文献馆编,,,1986-01-01,451页,中国文学论著集目续编.jpg
孙中山著作及研究资料索引,https://a.dushu.com/img/n200.png,¥0.00,南京图书馆书目部编,南京图书馆,,1986-01-01,148页,中国文学论著集目续编.jpg
外文新书目录：1985.9-1986.3,https://a.dushu.com/img/n200.png,¥0.00,中国人民大学图书馆外文采编组编,中国人民大学图书馆外文采编组,,1987-01-01,145页,中国文学论著集目续编.jpg
外文原版新书目录：1985,https://a.dushu.com/img/n200.png,¥0.00,中华医学会上海分会图书馆编,中华医学会上海分会图书馆,,1986-01-01,142页,中国文学论著集目续编.jpg
大连生物制品所、大连医院、大连医学院西文期刊联合目录,https://a.dushu.com/img/n200.png,¥0.00,大连医学院图书馆编,大连医学院图书馆,,1956-01-01,218页,中国文学论著集目续编.jpg
大连医学院、大连医院、大连生物制品所日文期刊联合目录,https://a.dushu.com/img/n200.png,¥0.00,大连医学院图书馆编,大连医学院图书馆,,1957-01-01,94页,中国文学论著集目续编.jpg
抗美援朝资料目录,https://a.dushu.com/img/n200.png,¥0.00,中央人民政府文化部文物局编,中央人民政府文物局,,1950-01-01,358页,中国文学论著集目续编.jpg
中国科学院图书馆馆藏中文辞典目录,https://a.dushu.com/img/n200.png,¥0.00,中国科学院图书馆编,中国科学院图书馆,,1958-01-01,31页,中国文学论著集目续编.jpg
清代文学论著集目正编,https://a.dushu.com/img/n200.png,¥0.00,宋隆发编辑,五南图书出版公司,9789571111728,1996-01-01,1060页,中国文学论著集目续编.jpg
辽金元明文学论著集目正编,https://a.dushu.com/img/n200.png,¥0.00,王民信编辑,五南图书出版公司,,1996-01-01,554页,中国文学论著集目续编.jpg
山东地区图书联合目录第九种：文化教育（中文部分）,https://a.dushu.com/img/n200.png,¥0.00,曲阜师范学院图书馆编,山东省科学工作委员会图书组,,1958-01-01,152页,中国文学论著集目续编.jpg
四川省各图书馆馆藏四川方志联合目录,https://a.dushu.com/img/n200.png,¥0.00,四川省图书馆，四川大学图书馆编,四川大学图书馆,,1958-01-01,34页,中国文学论著集目续编.jpg
特种文献目录：国际专业会议录,https://a.dushu.com/img/n200.png,¥0.00,陕西省科学技术情报研究所编印,陕西省科学技术情报研究所,,1972-01-01,96页,中国文学论著集目续编.jpg
先秦两汉文学论著集目正编,https://a.dushu.com/img/n200.png,¥0.00,韩复智编辑,五南图书出版公司,9789571111728,1996-01-01,190页,中国文学论著集目续编.jpg
三高农业、生态农业、立体农业及农业展望资料摘编,https://a.dushu.com/img/n200.png,¥0.00,华南农业大学图书馆农业信息部编,华南农业大学,,1997-01-01,113页,中国文学论著集目续编.jpg
中华人民共和国国史论著目录索引,https://a.dushu.com/img/n200.png,¥128.00,王美秀主编,当代中国出版社,9787800928710,2000-01-01,1023页,中国文学论著集目续编.jpg
中央研究院中日韩文期刊馆藏联合目录,https://a.dushu.com/img/n200.png,¥0.00,中央研究院期刊馆合作发展规划小组编,中央研究院,9789576714887,1996-01-01,727页,中国文学论著集目续编.jpg
词学论著总目：1901-1992,https://a.dushu.com/img/n200.png,¥0.00,林玫仪主编,中央研究院中国文哲研究所筹备处,9789576713491,1995-01-01,1347～2036页,中国文学论著集目续编.jpg
国会图书馆藏中国善本书录,https://a.dushu.com/img/n200.png,¥0.00,王重民编,国会图书馆,,1957-01-01,2册，666页，667-1202页,中国文学论著集目续编.jpg
上海图书馆善本书目：五卷,https://a.dushu.com/img/n200.png,¥0.00,上海图书馆编,上海图书馆,,1957-01-01,,中国文学论著集目续编.jpg
香港大学博士硕士论文目录：一九四一-一九八五,https://a.dushu.com/img/n200.png,¥0.00,暂缺,香港大学图书馆,9789627202011,1986-03-01,323页,中国文学论著集目续编.jpg
建筑科技文献索引：建筑设计部分 86-90,https://a.dushu.com/img/n200.png,¥0.00,建设部科技情报研究所编,建设部科技情报研究所,,1992-01-01,258页,中国文学论著集目续编.jpg
标点善本题跋集录,https://a.dushu.com/img/n200.png,¥319.00,国立中央图书馆特藏组编,国立中央图书馆,9789576780776,1992-05-01,2册,中国文学论著集目续编.jpg
东洋学文献类目,https://a.dushu.com/img/n200.png,¥0.00,京都大学文科学研究所编,环宇出版公司,,1989-06-01,5册,中国文学论著集目续编.jpg
法学论文索引：1987-1984,https://a.dushu.com/img/n200.png,¥0.00,内蒙古大学图书馆编,内蒙古大学图书馆,,1986-01-01,147页,中国文学论著集目续编.jpg
焦油白云石耐火材料专题索引,https://a.dushu.com/img/n200.png,¥0.00,冶金工业部鞍山焦化耐火材料设计研究院编,冶金工业部鞍山焦化耐火材料设计研究院,,1966-01-01,60页,中国文学论著集目续编.jpg
染料、纺织纤维工业,https://a.dushu.com/img/n200.png,¥0.00,上海图书馆编,上海图书馆,,1958-01-01,17页,中国文学论著集目续编.jpg
地方志·书目文献丛刊,https://img.dushu.com/2006/05/27/06471479666813.jpg_200.jpg,¥9700.00,孙学雷主编,北京图书馆出版社,9787501324637,2004-01-01,491页,地方志·书目文献丛刊.jpg
国外纺织期刊题录索引,https://a.dushu.com/img/n200.png,¥0.25,上海市纺织科学研究院印染工业科技情报服务站编译,上海市纺织科学研究院印染工业科技情报服务站,,1973-01-01,3册,中国文学论著集目续编.jpg
馆藏机械工程书刊目录：中日文部份,https://a.dushu.com/img/n200.png,¥0.00,上海图书馆编,上海图书馆,,1958-01-01,129页,中国文学论著集目续编.jpg
金属切削参考资料索引,https://a.dushu.com/img/n200.png,¥0.00,上海图书馆编,上海图书馆,,1957-01-01,20页,中国文学论著集目续编.jpg
科技资料目录：机械制造部份,https://a.dushu.com/img/n200.png,¥0.00,辽宁科学技术情报研究所文献馆编,辽宁科学技术情报研究所文献馆,,1966-01-01,26页,中国文学论著集目续编.jpg
中华人民共和国标准、部标准目录：机械工业1966,https://a.dushu.com/img/n200.png,¥1.00,第一机械工业部机械科学研究院，技术标准出版社编,技术标准出版社,,1966-01-01,186页,中国文学论著集目续编.jpg
全国机电产品革新展览会,https://a.dushu.com/img/n200.png,¥0.00,陕西省科学技术情报研究所编辑,陕西省科学技术情报研究所,,1972-01-01,60页,中国文学论著集目续编.jpg
